{
  "spec_version": "aac.presentation-manifest/v0",
  "id": "aac.builtin.report-rows/v0",
  "trust_class": "trusted-executable",
  "requires": {
    "bundle_kind": "evidence-bundle/v2",
    "profiles": [
      "spec_version:report/v1"
    ]
  },
  "audiences": [
    "*"
  ],
  "formats": [
    "html",
    "fragment",
    "embedded"
  ],
  "fallback": false,
  "priority": 1,
  "executable": {
    "carrier": "core-runtime"
  }
}
