{
  "spec_version": "aac.presentation-manifest/v0",
  "id": "org.example.composition-aware/v0",
  "trust_class": "trusted-executable",
  "requires": {
    "bundle_kind": "evidence-bundle/v2",
    "profiles": [
      "spec_version:org.example.exchange/v0"
    ],
    "extensions": {
      "required": [
        "composed/v1"
      ]
    }
  },
  "audiences": [
    "*"
  ],
  "formats": [
    "html",
    "fragment",
    "embedded"
  ],
  "fallback": false,
  "priority": 1,
  "executable": {
    "carrier": "module-slot",
    "script_sha256": "6b86b273ff34fce19d6b804eff5a3f5747ada4eaa22f1d49c01e52ddb7875b4b",
    "style_sha256": [
      "d4735e3a265e16eee03f59718b9b5d03019c07d8b6c51f90da3a666eec13ab35"
    ]
  }
}
