{
  "spec_version": "aac.presentation-manifest/v0",
  "id": "org.example.ambiguous-a/v0",
  "trust_class": "trusted-executable",
  "requires": {
    "bundle_kind": "evidence-bundle/v2",
    "profiles": [
      "spec_version:org.example.exchange/v0"
    ]
  },
  "audiences": [
    "*"
  ],
  "formats": [
    "html",
    "fragment",
    "embedded"
  ],
  "fallback": false,
  "priority": 1,
  "executable": {
    "carrier": "module-slot",
    "script_sha256": "4b227777d4dd1fc61c6f884f48641d02b4d121d3fd328cb08b5531fcacdabf8a"
  }
}
